{
  "produto": "ROTA — Transporte Sanitário",
  "resumo": "Frente de transporte sanitário: sistema de operação e a tese de investimento institucional.",
  "repo": "https://github.com/victorotaa/samais-rota",
  "estagio": "prototipo",
  "links": [
    {
      "tipo": "sistema",
      "rotulo": "Rota-OS",
      "url": "https://samais-rota.vercel.app/rota-app.html",
      "procedencia": "verificado",
      "fonte": "URLs informadas pelo Ota em 04/08/2026 (deploys próprios na Vercel do time samais)."
    },
    {
      "tipo": "documento",
      "rotulo": "Tese de Investimento",
      "url": "https://samais-rota.vercel.app/",
      "procedencia": "verificado",
      "fonte": "URLs informadas pelo Ota em 04/08/2026 (deploys próprios na Vercel do time samais)."
    }
  ],
  "papel_no_os": "Frente de negócio com sistema próprio e material de investidor pronto.",
  "atualizado_em": "2026-08-04"
}
